{
  "kind": "wincraft.plan.draft",
  "schema_version": "draft-2026-10-26",
  "pack_id": "wincraft.workday",
  "inventory_generation": 8,
  "input_digest": "35be1e49c8d87c38543c1ff1ca813b702e04e8668dac726553368e6e52b49723",
  "created_at": "2026-10-26T12:00:10Z",
  "expires_at": "2026-10-26T12:01:00Z",
  "status": "ready",
  "mutates_host": false,
  "requires_confirmation": true,
  "bindings": [
    {
      "binding_id": "agents",
      "provider_instance_id": "board-1",
      "status": "selected",
      "reason": "unique_eligible_provider"
    },
    {
      "binding_id": "metrics",
      "provider_instance_id": "metrics-1",
      "status": "selected",
      "reason": "unique_eligible_provider"
    }
  ],
  "blockers": [],
  "warnings": []
}
